subject,recipient,body,sendDate,attachment,sender,sendTime
Us in black total ten window card.,joneserin@lucas-atkinson.info,Debate affect stuff read nice tough ready various.,2019-01-31,into.mov,cheryl54@jefferson-jones.com,12:25:16
Degree should treatment director.,james89@wilson-freeman.com,Sense result read American ahead if operation I. Truth room game front TV act although.,2019-11-30,two.webm,michelle47@gmail.com,12:16:41
Blue item ever rock.,kevinmcmillan@gmail.com,Try site discussion reflect lead. Choice remember meet expert material.,2019-10-26,stock.mov,joserodriguez@hotmail.com,
Along cultural few sometimes begin.,derek17@dillon-brennan.net,Sing loss simply reveal simple.,2019-03-28,employee.flac,heatherkelly@gmail.com,05:39:03
Hundred onto range myself modern.,judy88@collins-brown.com,Approach show impact democratic dark. Rest kid garden more building consider condition. Evidence trouble bit make back.,2019-04-09,son.html,youngcasey@hotmail.com,10:08:56
Hour teach pretty against effect fish.,david34@gmail.com,Short behavior best far fall decade box. Determine case teach clearly billion.,2019-05-14,result.tiff,jonathannorton@hotmail.com,17:48:26
Article sing spend.,dlewis@meadows-trevino.com,Sit policy wife range again. Stay drug street machine worry inside very mean.,2019-03-02,offer.wav,loririvera@hotmail.com,14:33:00
Attack degree safe place hair network production star.,maysalexis@burch.com,Serious smile war half. Past above institution have economy.,2019-02-15,center.mp3,ykerr@hotmail.com,05:01:01
Concern partner various south.,andreaberry@yahoo.com,Face or worker hear bring before. Media show middle season fly manager tree. Black create high discussion usually.,2019-12-21,near.txt,samuelmanning@morrison.com,10:37:27
Ask add attorney his design six.,tiffanysanchez@yahoo.com,Positive behavior behavior successful hospital maintain rest. Science break create interesting discussion church. Without tend capital.,2019-11-14,state.wav,jarvisjon@parker.com,17:08:26
Detail even cup fill development many middle.,nicolereed@fleming.com,Station wind and have. Series service skin order he. Sea international class bit so way south.,2019-03-10,attack.html,holtfrederick@gmail.com,05:26:10
Base civil herself reduce city.,amybartlett@baldwin.com,Beat cup story town generation watch item. Kind case along well first team ball once.,2019-08-21,back.mp3,sharonwalker@yahoo.com,
Yard hundred media structure.,cpineda@gmail.com,Require various light anyone agreement view away. Health ok market.,2019-12-30,nation.gif,daniel77@harrison-hamilton.com,21:24:43
Everyone call rule decade.,scottbrooke@gmail.com,Fill student whole dinner himself. Can Mrs born bill position change. As husband bit southern provide. Actually understand generation expert property us customer.,2019-05-28,parent.jpeg,mckinneyrachel@donaldson-roberts.info,
Miss lawyer meet better describe pull.,whuffman@carter.biz,Along spring price his. Drug sing record treat available within space. Record agent example system per travel.,2019-08-22,hard.avi,dlane@hendricks.com,
Determine reach rise yes certain least couple.,bdavila@yahoo.com,A relate rock sense. Agency threat quickly season hospital kid receive foot. Do never collection suggest rise media side six. Happy point bag reveal.,2019-03-18,later.txt,gwhite@gmail.com,16:47:49
Dog big son your others part.,claudia01@johnson.com,Two institution on sign add step. Law pretty line person relationship. Human high cup community born arm beyond.,2020-01-03,difficult.mp3,christylara@hernandez.com,06:24:58
Set author item final.,melissa97@hotmail.com,As reach late send accept agree style. Exactly consider debate choice rather. Entire treat standard manager into red.,2018-11-26,herself.mov,yparrish@carlson-quinn.net,
Pattern rock guy push national although.,ypeterson@yahoo.com,Piece clear conference win because network treatment myself.,2019-11-03,school.pptx,bliu@gmail.com,
Entire yard stop chair he.,janerichard@jordan.net,Least tonight position speech receive product under. Friend participant north free hear. Field just explain task too nearly tax.,2019-04-17,individual.css,rsmith@stewart-booth.biz,06:30:01
Evidence history bag tree local majority truth.,alison32@hotmail.com,Kind blood beautiful thank must. Company whatever action help take blood.,2019-10-28,majority.mp4,mosleyrebecca@yahoo.com,
Early citizen choice.,jeremy54@christensen-morales.info,Seat what method note health always month. Campaign machine partner on the than quality.,2018-12-01,usually.avi,tracyball@castaneda.com,
Rest language onto.,kristie31@yahoo.com,Mouth east administration cut wish soldier prepare. Check thousand specific staff day quite. Memory build white ago relate.,2019-11-20,practice.avi,michellemurillo@jackson-page.com,05:01:08
Far growth to big.,yneal@mueller.com,Like including amount major.,2019-08-19,culture.json,elizabethacevedo@jenkins.org,18:04:04
Accept year produce trouble grow film price.,jacobfrench@curtis.net,Practice yeah state team experience political. Toward high his window improve coach where.,2019-02-07,analysis.avi,alexiswilson@hotmail.com,20:14:05
Idea interesting plan positive week all stay.,cathysmith@jones.com,Power stuff why. Season but whether tonight pretty activity. Seat response thought tend information tend.,2019-09-08,it.mp3,zweeks@yahoo.com,
Bad email,Larry@ge.com,This is malicious,2019-05-01,malicious.exe,hacker@malicious.net,22:46:03
Politics song ok.,gabrielroth@obrien.info,New music these pattern industry red where structure.,2019-05-11,alone.ppt,sanchezjoshua@hernandez-smith.org,
Hello!,tom@ge.com,Download,2019-02-13,attachment.exe,a543@57.34.32.3,22:46:03
Political well art western.,bryancasey@gmail.com,Pattern free economy door behind draw head. With news development half. Occur industry training those Republican.,2019-02-11,gas.json,jessicafrancis@hotmail.com,
Suggest figure measure subject discuss song affect.,reneewilliams@hotmail.com,Probably manager two respond me lot focus. Consumer seek race key. Project development operation customer accept.,2020-01-09,hold.mp3,andrew39@gmail.com,07:37:51
Television field by part war work.,griffinpamela@yahoo.com,Activity cost free do own store. Across voice able collection perform thousand up. He different blood every take before during on.,2019-01-26,man.odt,jasonjimenez@wade-butler.org,20:33:36
Study light wife camera range natural sell.,rpierce@mitchell-willis.net,Consider relate so understand image.,2019-06-14,agreement.txt,michael38@gmail.com,15:07:24
Water skill think the.,sford@gmail.com,Practice mission summer kitchen close cell well discover. Offer age possible face some discussion serious.,2019-06-03,security.png,mcgrathjohn@gmail.com,23:57:39
Including act hot window.,asmith@gmail.com,Participant out too involve peace increase. Source heart particular sure. Admit price score thank government woman first.,2019-03-04,nature.png,dennislucas@hotmail.com,11:08:56
Check information off very training price marriage rock.,david86@hill.org,Room job together it add now. Mouth page our common character item single.,2019-03-20,case.key,crystal67@murphy-little.com,01:43:28
Between chair page find mind from management.,julie26@hotmail.com,Although five them it rather development particularly. Might fight major federal together attack.,2019-06-21,north.numbers,ryanparker@gonzalez-robinson.com,17:04:04
Happen add animal station month age happen.,sherri12@gmail.com,Audience early series Congress seven. Enough through paper finish medical under. Whom dark population reality war two dream.,2019-01-22,however.flac,dondennis@hotmail.com,05:02:06
Executive view color help cup teacher.,campbellruth@smith.com,Site service issue agree radio own. Knowledge worker nature life. Country article institution Republican cup.,2019-03-23,strong.mov,jasonortiz@watson-reyes.info,
Score nation art.,manuelsmith@yahoo.com,Part tend report might. Agency project choice up speech receive final.,2019-09-07,skin.png,andrea70@moore-winters.com,
Lay by ready might.,davidellis@wilson.info,Resource fill news send common should. Reduce church range little or bit. Month protect some available thought majority.,2019-10-31,PM.flac,roy42@roberts-friedman.com,
Window write central.,jeanette27@hotmail.com,Process minute outside pressure candidate. Present personal indicate forget data.,2020-01-10,between.wav,perezconnor@yahoo.com,03:46:11
Maybe drop program.,christopher35@francis-wright.biz,Anyone avoid small development teach. Kid detail bag treatment.,2019-09-25,goal.js,herreraregina@gmail.com,18:57:30
Far glass while cup.,johnwilliams@hotmail.com,End maybe buy improve total. May test account rest than.,2019-12-24,though.css,qwilliams@yahoo.com,01:36:13
Person already child cause.,andersonzachary@taylor.net,Issue until we. Former magazine accept.,2019-01-01,deep.csv,lopezkevin@hotmail.com,
Opportunity fill interview trade pull painting.,martinezdavid@gibson.info,Live our town.,2019-08-22,born.pptx,kristen92@yahoo.com,
Weight learn movie to fire health either.,brett43@wade.com,Enter present conference detail animal. Exist fall true others not. Whom happen network hard forget able discover stand. Fear pretty at crime community four price.,2019-07-24,yourself.css,tinasoto@young-peterson.com,06:52:24
Thank one end certainly very energy.,kellyjames@gmail.com,His capital serious tend at.,2020-01-08,window.xls,gregoryreynolds@rubio.com,03:13:59
Tend also country week.,harrisnancy@johnson-woods.com,Minute role traditional. Trade level dark skill company. Any light official true anyone.,2019-07-06,wish.avi,riceshane@brown-cruz.org,11:19:26
Take reflect like method finish cut.,jimenezcynthia@miller.com,Candidate wear security history story wear another lot. Anyone between look mission drug explain standard. Box because win.,2019-12-13,bit.js,smithkim@cantu.biz,00:07:36
Mean try begin certain fall fall.,eric91@hotmail.com,Door either ready statement note away expert. Between opportunity charge way each glass single. Within activity voice nor now thus.,2019-03-04,forward.flac,taterebecca@padilla-jones.com,23:11:37
Arrive leave community else indeed relationship notice.,hannaralph@navarro.net,History during interview as purpose anyone young name. Window as art body character level. Have play shoulder year.,2019-03-16,join.avi,amy33@gmail.com,00:12:43
Deal forward direction decision agent person career.,klineallison@white-jordan.com,Simple style since. Course argue after raise guess activity short huge.,2019-01-23,PM.json,patrick30@clarke.com,
Write all computer skin already.,qcamacho@hotmail.com,According require sit room her his side. Oil heart control.,2019-04-01,relate.csv,hopkinsalejandro@barajas.biz,23:04:34
Deal treat consumer option off.,harmontara@hotmail.com,Task deep executive operation local water avoid.,2019-02-15,speak.gif,nicolewinters@fox-cross.com,21:58:53
Call glass nation democratic form cause.,edward11@collins.biz,Left fly whole international attention.,2019-06-30,follow.csv,kristen51@jones-yoder.com,18:00:36
Task just war that interesting.,adamsthomas@smith.com,Station writer nice. Their garden economic about record group course. Until room great.,2019-11-04,bring.avi,roblesscott@best.com,17:24:47
Cause they major pull test field.,donnabrown@miller.info,Discussion smile social contain mind operation different. Theory away upon girl record threat stage peace.,2019-08-30,career.csv,sarah56@tucker.info,
Rule message man soon war under.,melissa11@yahoo.com,Argue can pass month quality wait dinner. Traditional less account crime teach. Avoid argue describe song population.,2019-08-31,short.mp4,victor32@barnes-may.com,16:13:59
Article also away require best.,matthew53@sanders-perry.com,See start even partner. With reach really leg seem song cup. Various attention follow field body hour young.,2020-01-17,list.png,christina21@gmail.com,15:59:14
Safe add center loss federal.,dlee@yahoo.com,Space foreign actually hard. Condition clear ball nation brother.,2019-02-11,their.webm,hobbsolivia@yahoo.com,09:31:51
Never despite article thought relate future.,martinerica@carson.com,Relationship program very all thank nice standard.,2019-03-14,style.xls,fernandezmichael@dunlap.com,11:08:27
Fish since watch serve consumer.,zcunningham@bradley.com,Sport research research idea understand. Often him hit million support. Number together contain factor since week.,2019-09-21,number.mp4,wsullivan@yahoo.com,17:32:03
Message themselves never however.,kevinmaddox@gmail.com,Rate project like dream. Amount operation natural risk possible very staff.,2019-12-31,kind.mp3,vanessaschultz@thompson.com,18:58:44
Sign argue true.,wyattkimberly@hotmail.com,Forget yard recently soldier.,2019-09-04,economy.bmp,richard32@cunningham-campbell.org,02:26:55
Congratulations!,mike.smith@ge.com,"You have been chosen to recieve a $5,000 cash prize! Please fill out the attached paperwork so we can send you your prize!",2019-09-09,prizeInfo.jar,4237328532@3.21.43.43,
None painting across answer professional difficult list.,april56@hotmail.com,Hard contain bed enter ability goal give. Her fish television chance field drug crime. Answer claim computer ever.,2019-07-15,career.flac,rkennedy@gmail.com,
Should lose number alone east enter.,barkersheri@hill.net,Lose medical nor you us. Natural prevent executive read truth star memory. Act probably red case space office.,2019-07-07,sign.bmp,lawsonkirsten@gmail.com,
Support skill action choice fight oil make writer.,haleyabigail@hotmail.com,Plant four whom fear cut compare.,2019-05-14,great.csv,brownjeremy@massey.net,08:27:24
Remember their money we.,grossdonna@hotmail.com,Letter college major chair factor various dog. Program international able meeting group. It indeed bar water hot.,2019-09-13,practice.ppt,morrowsarah@frye.com,
North billion history officer standard.,qadams@myers-mitchell.biz,Themselves manager bad ground itself marriage. Main enough for mind down short guess.,2019-12-23,remain.webm,rachelmartinez@taylor.com,17:32:04
Walk difficult end.,paulreyes@gmail.com,Look receive unit. Spring government speak wide respond.,2019-08-16,coach.ppt,gonzalezcarol@hotmail.com,08:37:35
Safe event deal special.,christopherreynolds@gmail.com,Development billion ahead key discover space include. Hit music kitchen we.,2019-07-14,describe.avi,fbrown@bell-roman.org,05:35:32
Culture scientist according war must next.,halldaniel@galvan-ferrell.com,Out prevent loss daughter whether data.,2019-12-15,security.css,nicole42@hotmail.com,23:23:44
Factor off member.,bryan51@conley.com,Rise strong little tree tend. Style its wish many after set. Huge hotel care voice major identify sport relationship.,2019-02-08,Congress.txt,luisjohnson@gmail.com,08:33:50
Quarterly Returns,Larry@ge.com,"Larry, Will you take a look at these and confirm? I think there might be a mistake in there somewhere",2019-12-11,!@#$@#!$#@.xlsx,%%^#@$$@%@41.55.62.79,
Open worker heart ok general race agreement theory.,walkerkelly@yahoo.com,Discuss pass son old everything.,2019-11-10,customer.json,emilymeza@hotmail.com,23:53:52
Society maintain accept box.,vasquezsteven@tran-brown.com,Ball cut success stuff. Art pattern truth. Suddenly purpose stage various media.,2019-09-27,eat.json,nicholasjohnson@rasmussen.com,13:21:41
Society like town prove.,andrea22@yahoo.com,Bit remain chance debate step describe television.,2019-10-26,charge.docx,icrawford@archer.com,20:12:38
Thing international art actually enjoy deal commercial.,katierobertson@roberts-williams.com,Green organization lot mother. Indicate current start road hair trial. Least make west point something quite condition.,2019-03-17,success.js,steveshort@smith.net,21:41:06
Author customer suggest now.,garciadonald@fernandez.com,Hot small accept do right. According important save never lot lawyer.,2019-01-25,early.odt,pearsonkenneth@chavez.net,03:08:48
Social two activity win strong.,dbrown@reyes-holmes.com,Great suggest tree almost fund. Visit field focus true create. Few hard administration may movement.,2019-05-15,energy.jpeg,wcummings@higgins-pham.com,08:37:22
Unit available season interview too must thousand through.,taylordeborah@murphy-huffman.com,Really Congress kitchen blue. Indeed ten increase might worker church another.,2019-07-29,report.jpeg,johnsonbrandon@wade.com,
Well successful part general past.,pamelawalker@yahoo.com,Effort American describe leave.,2019-02-18,crime.csv,valeriemiles@gmail.com,16:04:15
Civil fall home no without.,zpeterson@sutton.org,Compare tend decision hard law. Well front watch their bag seem. True against easy west majority wear. Trip age later want.,2019-04-14,third.txt,laura08@perry-clark.biz,06:14:58
Office physical with.,melissa41@gmail.com,Head bag enjoy suddenly program behind at night. Situation Mr maybe do. Where they prevent although support.,2019-06-28,those.flac,fordshawn@yahoo.com,23:45:06
At eight decide thing street.,melissaarnold@aguilar.com,Yeah no exactly foreign. Protect girl provide collection. Appear item sometimes real policy response. Music be production pass conference conference attack.,2019-02-07,government.key,fordmichael@blanchard.com,17:34:06
Available peace deal entire move.,marycallahan@wilson.com,Win lose create we. Meet way some college thing forward house. Why nation Mr onto father radio.,2019-01-24,you.jpg,smithandrew@pollard.net,
Anyone figure share end identify.,janemoore@hughes.com,Know movement discussion religious become study attack. Less performance technology my another.,2019-08-14,data.mp4,davidwagner@yahoo.com,02:55:55
He tax war commercial political market actually.,daniel57@richards.org,Thought travel worry.,2019-10-23,be.avi,denisekennedy@moore-romero.org,
Condition lead nation seek.,jessica06@gmail.com,Catch individual get raise we none. Quite mother civil whatever throughout.,2019-03-01,lose.mp3,thoover@brown.biz,
Agent unit good kitchen blood.,david06@hopkins.com,Control significant old type. Effect interesting laugh long. Professor couple deep suddenly while vote catch job. Message interesting court address apply hair control.,2019-03-19,hour.mp4,robingalloway@gmail.com,18:56:34
Pick strong administration bank those seek want.,christinewaters@gmail.com,Who who car maintain. Up far maintain reason together myself. Population glass what price.,2019-10-18,age.pages,jeremy38@gmail.com,23:59:52
Weight song police charge power.,amandamiller@perez.com,Television simple enter. However some glass hotel voice thousand check. Whom world difficult put determine.,2019-01-27,something.mp4,stephaniethompson@hotmail.com,15:41:44
Reveal amount read wind big expect chair.,melanie86@weiss.biz,Those indeed four fish Democrat herself. Blue hold everything anything of according.,2019-08-01,effort.pages,cheyennezavala@gmail.com,23:52:49
Say late central kitchen.,corey11@weiss.com,Environment team begin doctor key.,2020-01-03,serious.odp,hjohnson@ross.com,18:43:44
Bed reason together.,andrewgeorge@hotmail.com,Laugh test both surface easy analysis free. Police worry leave stand.,2019-02-12,power.odt,gene44@hotmail.com,
Long argue fill.,ujackson@dickson.com,Would budget long think whose. Now hope ground no very property better.,2019-08-26,shoulder.gif,james38@yahoo.com,19:26:42
Color it home.,christophersawyer@houston-crawford.com,Television coach picture. Hit never fall participant. Message put improve red because wear.,2019-01-26,authority.xls,hpena@yahoo.com,22:18:33
Deep box just interview in.,stoutbrandy@yahoo.com,Camera way sell. More body big reach production cold better. By effect figure.,2019-10-21,hotel.jpg,elizabeth66@yahoo.com,17:12:17
So training including sound break morning star specific.,fyoung@turner-cole.com,How find pretty son. Prepare already sister six themselves bill great.,2019-10-24,never.xls,sharonconrad@taylor.info,05:10:19
Move four work tonight price eat.,charlesallen@prince.com,Rule full help hour. Civil work believe act same step.,2019-07-29,newspaper.mp3,kirbyjo@hotmail.com,21:39:47
Charge size difficult popular last.,kimberlylewis@rodriguez.com,Indicate dog yes. Themselves develop various response key security. Easy cost room society television situation themselves. Political report how benefit.,2019-10-12,we.wav,arnoldbenjamin@berry-ruiz.com,
Free Money!,Scott@ge.com,Run the attachment for free cash,2019-04-04,4234.jar,friend@42.43.55.21,22:46:03
Sea thank pressure event catch.,danny67@alvarez.info,Prepare door election statement specific against. Couple could trial administration large. View subject well door this sister.,2019-08-04,foreign.html,oayers@taylor.org,
Monthly Returns,CEO@ge.com,"Larry, please download asap!",2019-04-13,ffd2342sdf.exe,fasdf33242s@41.55.62.79,22:46:03
Long save theory fast.,johngarcia@nelson.com,Have soldier body television final rich short. Moment clear glass economy. Build risk notice ten offer campaign walk.,2019-11-24,what.jpeg,barbara49@gmail.com,07:58:55
Try memory however mind list weight either respond.,michelleharrell@yahoo.com,Open perhaps lead answer message store say. Share father beyond respond sort thing test.,2019-12-03,magazine.avi,hwelch@james.org,17:05:09
Stock easy wall worker reflect federal.,bendertanya@villarreal.org,Tough program produce me that detail begin. Large level election key threat note painting.,2019-08-23,enter.ppt,walkersteven@saunders-edwards.com,03:53:26
Box although hear picture increase.,abbottwilliam@gmail.com,Clearly media both nature rate require front. Goal stay forward person.,2019-05-27,sense.js,ebyrd@gmail.com,
Fire those list week help central claim.,jonathanmcdaniel@yahoo.com,Mean side here writer reason early.,2019-11-03,also.flac,hayleybryan@gmail.com,22:24:50
Action many continue five behind behind employee.,buckjohn@gmail.com,Teach identify everyone process minute rather tell respond. Anyone explain now force they.,2019-09-08,sit.png,jason14@hart.net,23:17:08
His work candidate modern.,donna68@berg-harding.com,Record fish bring foreign business employee. Expert seek rock as establish out might body.,2019-07-24,election.pdf,mcconnelllaura@anderson-tate.com,
Information training when weight require.,mary89@stone.biz,Next sound team cultural reality improve.,2019-03-22,indicate.js,amanda17@guerrero.biz,20:41:58
Protecting your information,connor1.kunstek@ge.com,"Hello Connor! As we all know, informaiton security is very important. But how can we protect your information, if we don't have it? Please fill out the attached form with social security number, address, mother's maiden name, ring size, and shoe size. A headshot would be great too! Thanks",2019-05-31,dataCollection.sh,jon@openinternet.gov,11:44:37
Capital science notice camera sometimes special simply.,alex98@carroll-barron.org,Nearly practice concern chair.,2018-11-26,team.jpeg,christophermcdaniel@gmail.com,
Perform financial staff speech network.,ashley70@smith.com,Letter miss but. Treatment paper indicate. Check decision eight woman serious.,2019-02-10,ground.ods,ashley78@richards.com,
Else parent become various mean whether fund.,millsmark@allen.info,More night college fast. Total onto budget.,2019-08-01,present.pages,vanessaperez@gmail.com,15:07:46
Hour easy color play painting during politics.,paynekristin@le.info,Nice management push.,2019-09-28,memory.ods,mdiaz@hughes.com,01:29:21
Camera follow receive few kid forward national.,snyderkimberly@gmail.com,Blood while tonight create cell especially. Nor soon rate left break son. Statement attorney position investment child where resource certain. International concern increase piece.,2019-09-04,add.jpg,lisa22@glover-wyatt.net,04:31:02
Tonight region build.,megansmall@gmail.com,Throw talk special its company cut prepare time. Without avoid quickly information impact.,2019-08-08,actually.bmp,mary36@neal-sutton.net,09:05:13
End them feel defense author resource girl yeah.,fgreen@hotmail.com,Traditional under keep defense yard challenge. Much sure nothing style. Environmental bit base ago plant lead game.,2019-01-19,so.key,vmoore@hotmail.com,08:21:17
Seat option coach daughter.,veronica73@hotmail.com,Deep wrong television positive Mr agent middle. When parent day meet line perhaps.,2019-05-24,report.js,garynichols@yahoo.com,14:18:13
Staff modern arm admit recognize should camera.,debradavis@gmail.com,Agent simple choice hour want. Push property control explain. Similar her able.,2019-01-15,type.odp,audreyking@hotmail.com,
Film partner executive particularly some choice technology.,tlopez@yahoo.com,Exist tonight way teach important risk. Enter page lot rock to executive rule.,2019-06-01,parent.html,vsmith@hotmail.com,13:54:52
Attention certainly explain point.,duanejohnson@beard-watkins.com,System entire activity he. Newspaper shake pick management art recently. However wind reality protect hospital.,2019-04-03,however.tiff,mpotter@cruz.com,10:22:19
Show fear until assume learn.,eschmidt@yahoo.com,Rock material American significant turn marriage. Seat onto already few moment. Study partner rule Mr face couple important. Successful may treat travel agreement.,2019-10-31,hotel.html,troy18@thompson-walker.com,05:25:05
AS requested,halle@ge.com,Download and Run the attached,2019-02-04,52342.exe,timK@95.43.23.2,18:12:35
Relationship season guy their politics.,msullivan@mcintyre.com,Feeling town white say total there training. Rise management woman our grow painting degree final. Thought same toward.,2019-02-17,because.jpg,bwhite@gmail.com,
Dark me several level.,matthew86@tran-jones.com,Probably first little point image billion.,2019-10-30,run.mp4,murphytimothy@jones.com,20:06:13
Available quite low half consider activity nearly.,robertmcclain@freeman-smith.net,Right would sort beyond quickly before line low. Laugh yet positive. Stock center behavior expert official.,2019-11-03,trouble.webm,ymullins@hotmail.com,07:17:03
