subject,recipient,body,sendDate,attachment,sender,sendTime
Sell nice war box check.,utaylor@yahoo.com,Sense speech should century speech understand raise. Level small even movie grow operation short. Through whether wrong send night.,2019-05-28,follow.html,cbell@lee.biz,04:28:05
Article present bit.,snyderemma@brown.com,Meet face store treat. Stuff third despite in student.,2019-08-15,key.bmp,porterbrandy@tucker-hamilton.net,
Share high poor they.,wruiz@aguilar.com,Recognize him firm lead gas sister. Long blue week soldier cultural course safe television. Far agent language suggest.,2019-03-15,mother.tiff,jacksonthomas@hotmail.com,
Pattern likely computer and.,shawnholmes@gmail.com,Like its ask change red product window through. Fast sport soldier nothing imagine. Record stop modern trip.,2019-04-28,meet.gif,jasonthompson@stewart-andrews.com,04:06:23
Reason quite thought scientist.,clarkwendy@hotmail.com,State from trial. Mouth room act partner political challenge red. Argue sometimes expert herself structure.,2019-10-08,man.js,cardenasann@yahoo.com,18:36:16
Fact president ability however car.,fandersen@yahoo.com,Nearly both material. Born late tend relate that voice he. Top hour political media which some.,2019-07-15,money.gif,charlesroach@yahoo.com,09:19:48
Within leave strategy animal skill north.,monicaorozco@gmail.com,Piece force step family. Standard agree analysis.,2019-08-21,democratic.json,arodriguez@munoz-irwin.com,08:02:16
Reason speak director think doctor dog.,emily23@cook.com,Student raise former happen change service. Three question direction. Young whom garden cover town organization trade.,2019-07-28,debate.bmp,samuel21@harris.info,09:58:49
Level strong interview mean specific again.,robert07@hatfield.com,Already future thought them.,2019-12-07,wait.wav,ugriffin@chan-kennedy.com,22:45:40
Must issue feeling build economic.,yandersen@cortez.com,Feel window player well cut these. Despite to skill.,2019-08-18,physical.wav,morrisamy@hotmail.com,06:36:39
Attorney eye nor.,tlynch@matthews.com,Interesting two know stand perhaps close else. Yes away conference.,2019-01-04,almost.ods,hoganandrew@martin.net,
Other when them shake.,turnersteven@parks.biz,Purpose sell above check pretty.,2019-01-24,green.jpeg,sarah22@yahoo.com,04:13:15
Ago impact live street require buy.,darlenereyes@tyler.info,Left quickly night other. Determine line soon future wife. Door prevent heavy statement dinner bit pay design. Set purpose dream.,2019-10-28,simple.webm,ffrye@yahoo.com,
Better specific song peace bank generation discussion.,imurray@watson-watson.com,Fill professor new gun write clear.,2019-11-07,country.flac,austinlambert@gmail.com,20:59:48
Choose sell appear bed.,marygreene@anderson.net,South possible measure still actually. Act sound safe medical same program. Form glass get visit.,2019-02-25,should.flac,julianfrederick@strickland.info,14:25:05
Put effort city we.,amyjackson@marshall.com,Direction look trial mother where in. Involve cut need school.,2019-05-14,rich.bmp,hannah59@gmail.com,11:43:46
Throughout toward receive exactly human hard thank.,armstrongkevin@bryant-fitzpatrick.com,Pass point sound cut international rock American so. Notice read blood big who. Whole than up analysis region.,2019-02-04,practice.ods,dawn13@roberts.biz,01:06:22
Pull company wonder item tell enjoy type.,rachel93@williams.info,Consumer also real look father. Per make behind bag pay practice thought.,2019-04-24,school.js,charlesrobinson@yahoo.com,15:52:11
Guess perform then.,pughdouglas@petty.info,Tax book yet seek see it international rule. Newspaper argue brother me. Admit resource best several catch save full store.,2019-06-13,wish.ods,timothy64@ferrell.org,05:05:07
Situation international win hand visit.,cookgregory@hotmail.com,Democratic around camera report four land. Four but within check unit.,2019-08-19,indicate.wav,rodneyharris@hotmail.com,02:26:36
Civil foreign her establish season.,smithdavid@martinez.com,Dinner send with kid service. Animal hair I. Process surface participant result issue such design candidate.,2019-07-29,economic.gif,leslie39@griffin.com,06:23:06
Tell opportunity machine ten save increase rather key.,laura39@davis.com,Here thought mission age resource detail teacher majority. Technology consumer happen performance seek. True nature response much wind. Wind clearly must government.,2019-03-11,information.css,christopher77@gmail.com,
Fire news feel evidence seat.,samueljackson@yahoo.com,Morning business seem. Coach use project yet billion remain.,2019-06-14,foreign.mp3,anthonymyers@hotmail.com,14:35:30
Generation toward piece audience power seat this.,aliciajohnson@weaver.com,Top similar or by buy spend such ball. Moment where difficult tough after. Under election pressure along under require fish. Pm lay team.,2019-02-24,will.avi,murphyeddie@hotmail.com,09:45:57
History behavior instead inside letter.,vincent51@yahoo.com,Fund administration keep prove who during actually part. Yes paper friend question guy.,2019-10-09,gas.key,turnerelizabeth@stark.com,
Difference without walk everybody.,christopher64@yahoo.com,Window he fine of become treatment.,2019-12-04,kind.jpg,sliu@hotmail.com,15:57:15
Reveal single age live else.,davidramos@smith.net,Job blue young. Ball toward he around within. Protect yet blood stuff forget heart what.,2019-02-12,nothing.jpg,baileyserrano@yahoo.com,22:58:54
Down report shoulder may.,vparker@cross-buchanan.com,Last forward value place. Politics assume include.,2019-03-31,imagine.wav,williamharris@webb.com,06:41:49
Clear wife quickly ago our sing too still.,danielle26@randolph-martinez.com,Church according foreign room step son resource meet. Too road them business. War throw success small resource speech often.,2019-09-21,likely.doc,durannicole@gmail.com,
Visit truth side three according executive almost.,jacobhorn@hotmail.com,Hotel above ago participant against. Finally campaign together live fish notice near. Recent reach poor technology decide.,2019-12-06,nice.mp3,thompsonbrian@price.com,15:16:10
Main trouble return save.,timothybrown@hotmail.com,Explain into interview eight feeling. Deal finally prevent its imagine school. Station camera both top program learn within.,2019-05-02,opportunity.wav,martinezcaitlin@chapman.com,06:16:09
Share threat international study upon tell.,elizabethhayes@hotmail.com,South technology grow heavy technology collection. Building big notice accept economy skin Democrat. Camera cost great project wonder coach.,2019-12-08,situation.gif,johnsmelissa@walker-shannon.info,01:06:09
