subject,recipient,body,sendDate,attachment,sender,sendTime
World million response trial short.,fstokes@young.com,Because think cause nearly else today. Fund result certainly century spend. Identify during hit off memory future tough nature.,2019-11-20,spend.png,mcfarlanddennis@hotmail.com,03:07:27
Reality us collection debate probably short defense.,dan52@morton-holmes.info,Product candidate check democratic technology cut heavy. Color between four throw reflect. Ask data receive range security water kid.,2019-09-18,recent.html,ysolomon@mejia.net,01:18:36
Star wars fan?,gary@ge.com,"Hey thanks, here it is!",2019-02-01,jar.jar,ggffggsgee@rei.com,22:46:03
Off small market management ahead.,burnettholly@lee-bradford.org,Morning understand hope rise show culture. Result population certain us occur speech ground. Spend across war.,2019-11-18,become.jpg,joshuaharris@hotmail.com,13:07:20
Spring student prevent.,ricky66@ryan.com,Spend according fear or spend. Chair measure every shoulder so where.,2019-04-01,skill.jpg,marissachristensen@joseph.biz,14:17:41
Season fear worry mouth director affect citizen.,mitchellanita@rodriguez-santiago.com,Miss hear significant catch town. Baby include analysis.,2020-01-09,resource.json,johnblevins@clark.info,09:24:26
Coach land phone.,rubenbrown@mcclure.com,Guess maybe discussion.,2019-06-21,other.txt,brianlyons@lyons.com,09:05:27
Perhaps memory strong point.,lwerner@yates.info,Stuff job fly staff record program. Piece sell offer impact picture five.,2019-08-24,rich.avi,dudleychristopher@gmail.com,11:16:21
Next major race baby question social term.,james21@yahoo.com,Buy woman break pay strategy kid. Then report fact imagine national. Wife true company system argue specific.,2018-12-02,change.csv,jclark@french.info,
Rise per during blue speak tax condition.,mayerdenise@gmail.com,Leg government own concern night hope method successful. Chair president dinner develop.,2019-11-27,positive.js,jacksonyolanda@hotmail.com,22:48:46
Environment imagine father within.,cynthia52@yahoo.com,Site paper option newspaper grow third. Stage seek base. Hold either approach most try PM discover. Central conference any voice edge.,2019-12-14,cold.xls,julie65@ayala-gonzalez.biz,11:30:09
Science national action middle.,michellepetersen@hotmail.com,Billion conference case. Fund deep read I way. Anyone local miss television.,2019-07-17,popular.webm,michael70@hotmail.com,04:42:36
Pattern full clearly loss through arrive attack color.,spierce@potter.org,Bill physical affect fight meet that. Whose care fear inside.,2019-02-09,make.webm,shannon89@hotmail.com,
Administration soldier upon machine sign suddenly within order.,lrodriguez@hotmail.com,Some share fund impact current whom reflect become. Space ever assume success carry should.,2019-11-29,between.wav,darlene92@gmail.com,18:00:51
Same around born various.,amanda10@bradford.com,Of add themselves others red fund still. Risk ability my economic less available again. Million everybody change some usually.,2019-08-25,sit.bmp,lauragonzalez@jenkins.com,13:07:40
Series national from.,smithjustin@higgins.org,Shoulder reach prove drop. Cultural likely theory model civil responsibility.,2019-04-28,run.mp4,mjones@hotmail.com,01:53:28
Arrive we economic plant school.,tmartin@yahoo.com,Party discover already both financial plan resource. Occur consider center. Statement player use mention way bit.,2019-08-31,long.flac,qfuller@kelley.net,
Figure clear those.,ashley83@turner.com,Five interview military fast individual real. Technology you about same kid.,2019-07-11,book.flac,jenniferfrancis@yahoo.com,
Instead character care sell.,julie99@yahoo.com,Morning whose himself realize attention. Candidate soon word teacher. Place TV director evidence example.,2019-06-15,involve.flac,hahnjames@gmail.com,
Others west decide beautiful group.,laraalicia@romero-miller.biz,Each property personal do big radio might.,2019-04-28,food.pdf,taylor89@hotmail.com,15:52:01
Position forget great picture.,hjohnson@reed.com,Bad house action certainly wish television that.,2019-02-08,name.csv,johnsonalexis@gmail.com,17:00:07
Picture street nice camera choose herself particularly.,christinapratt@yahoo.com,Old concern manage foreign past road wait. Tell even whether know quality effect.,2019-06-24,face.docx,brockderrick@watkins-malone.info,09:33:56
Produce control amount development hit but.,gsnyder@gmail.com,Clear record across. Bring job focus question step which seem.,2019-09-04,city.docx,mmorrison@wilson.com,
What a entire.,miawilliams@mendoza.org,Too must stock evening page. Sure task myself according here only instead.,2019-05-17,newspaper.wav,rodriguezyesenia@martin.com,17:02:53
Loss traditional senior red information.,nathansmith@yahoo.com,Easy product those month receive many. School lawyer shoulder machine. Method voice country.,2019-05-01,whatever.flac,jesseweber@may.org,07:58:12
Lay article of deep table anyone blood.,xrussell@baker.net,Quality detail move respond. Family clearly material season security Republican. Send about walk visit general identify.,2019-08-21,author.webm,joe03@hotmail.com,04:50:16
Ago wind through lead lot reach.,nbraun@burns-taylor.com,Process conference coach try detail wonder power star. Ask building because both six reflect.,2019-08-06,time.csv,stevenbryant@hotmail.com,20:49:22
Box according nearly high end.,racheltorres@hernandez.com,Pressure today child consider. Tell apply debate about stock. Government issue hair she turn.,2019-11-29,short.wav,scarter@gmail.com,03:07:13
Decade challenge total alone.,tjohnson@gmail.com,Item experience sit tough kind. Might others money idea sell. Other film station number teach thousand material any.,2018-12-01,audience.css,coopercurtis@brown-reeves.com,
Near fear who hot avoid mean.,mooredaniel@hotmail.com,Nature move clearly member entire small health.,2019-05-28,feel.doc,josewalls@weeks.com,18:53:09
Continue leg program blood.,garrettdale@yahoo.com,Fear agency until international. Smile operation will technology tell director. Hear a require store what.,2019-05-21,ahead.key,parkerjames@hensley.com,12:01:08
Born college purpose make indicate buy hospital.,walkerjames@munoz.biz,President power church everybody who.,2019-03-01,result.jpg,toddphilip@hotmail.com,17:12:03
Draw have sell.,macdonaldlori@hotmail.com,Practice interview plan close. Main like pattern only address finish kid. Including economy total may. Well agency great world full.,2019-01-05,eat.pptx,obrown@gmail.com,
Third party half add.,jeanettemarshall@hotmail.com,Maintain social sound rule speak. Science relate establish right ahead piece.,2019-06-01,space.ods,parkcheryl@brewer-spencer.com,13:44:29
Student daughter American when.,princenatasha@brewer.com,Case approach our again it world near. Knowledge well policy decide by whom but table.,2019-09-19,radio.mov,jamesbooth@reyes.com,06:18:04
Ok five modern family.,donaldchandler@beasley.com,From speech attack.,2019-08-23,certain.jpeg,michael39@yahoo.com,23:49:30
White middle guess miss cultural rate easy.,sarah12@yahoo.com,Wish message glass sit situation simply soon tonight. Little work out cause model.,2019-02-07,between.key,leebrandon@yahoo.com,17:59:18
Full serve wonder message place full.,pauljones@carpenter-parker.info,Speak senior my just service. President poor author stuff.,2019-06-26,later.mp4,leroyrichards@gmail.com,17:58:09
Everybody sound idea dream difference modern.,mullenlinda@yahoo.com,Remain baby reveal. Somebody recently speak rate season. Feeling research hot.,2019-03-19,debate.ods,ljohnson@yahoo.com,21:42:40
Until get language possible one decide.,pedro46@myers.net,Experience man six agent. If push discover size than. Decision defense cell position.,2019-06-13,away.ods,umiller@yahoo.com,
Down herself condition somebody similar type represent.,brandon23@parks.com,However happen rate business occur mind. Leader reality how without kind while. Answer thought the hope tell once.,2019-03-03,parent.key,allisonbowman@yahoo.com,
Through read paper talk fall lose.,imoore@hunt.net,Evening take whatever school water. Standard agency when add.,2019-05-10,compare.tiff,claytonthomas@hotmail.com,
Your affect surface environmental next entire.,mercermartha@gmail.com,Pick size PM offer. Be eye over general write question.,2019-10-16,very.webm,donaldlopez@hotmail.com,20:55:11
Customer herself away point special purpose.,raymondphelps@hotmail.com,Under throw consider toward but response bad. Media argue job authority trade. American question medical interest moment hair again.,2019-05-12,attention.mp3,david60@montgomery-blankenship.net,08:46:57
Race agent whether run.,thompsondavid@hotmail.com,Miss born arm treatment police power fine. Republican they necessary change.,2019-09-09,positive.mp3,zhodge@adams.com,06:24:32
Imagine cell of tough race.,heatherjacobs@hotmail.com,Nothing guess each world stuff. Although form moment region.,2019-09-08,today.mp3,yujasmine@smith-robinson.com,01:51:25
According though customer often.,ljames@gmail.com,Baby physical others traditional role always it. Provide this after quality. Young as hold appear.,2019-08-02,tell.pages,harringtonchloe@gmail.com,
Song another own challenge new to.,hrodriguez@hotmail.com,Up source forget number relate financial. Reason little adult month. According by region true eat.,2019-09-12,drug.flac,danielsheidi@hotmail.com,10:22:10
Drop adult white herself.,johnsonkatelyn@boyer.net,Its coach like ok. Anything imagine cold economy dream trip. Sit success appear boy professional down. Not teach art month page middle senior.,2019-08-13,record.mp4,danielsantiago@cole.com,01:19:02
Would huge central.,hudsonkevin@hotmail.com,Wonder sell enter. Reason but goal citizen.,2019-02-14,produce.webm,utucker@parker.com,
Federal camera local car heavy amount everyone.,lisa81@hotmail.com,Task clear some once toward. Nation popular painting main. Learn voice explain might alone against. Drive property start century.,2019-01-23,indeed.js,thomasnancy@hotmail.com,
Owner drive nothing program.,cannonisabella@taylor.com,Blood executive door event real skill. Hear father kind language only sound.,2019-11-14,pressure.webm,lgallegos@jordan.com,20:07:12
Eye night PM table right.,carlos70@ramos-young.info,Miss choice consider make wall. Expect Democrat prepare student kitchen provide board. Only when central bring budget size.,2019-07-14,wonder.flac,ncohen@roberts-parker.com,00:54:10
Point data history it.,smithjoan@murphy-velasquez.com,Fall language board style official admit. Item move machine religious scientist coach run.,2019-03-29,they.mp4,fmann@hall.com,00:55:05
Information school seek simple PM.,jake62@johnson.biz,But under decision. Moment room answer rest.,2019-10-05,heart.mov,murraymelvin@brown-moore.com,11:38:24
Twitter API service account,bo@ge.com,"Hey Bo! I was sending  you info about the service account you requested for the twitter api. To complete, please click this link twitter.co",2020-01-07,twitter.exe,jack@twitter.com,19:34:51
Future oil past movement.,imacias@davis-andrews.com,Hair consider tax choose various job method. Mr agent concern raise.,2019-03-09,trial.mp3,hsmith@hampton.org,01:03:37
Candidate trip onto education page various these.,john85@hotmail.com,Size certain today book course expect that. Check great start letter voice bring level.,2019-08-26,chance.png,stevenwallace@hotmail.com,05:56:09
Along brother stage whether anyone piece protect.,peterfinley@gmail.com,But majority best bad personal game.,2019-08-18,move.avi,susan62@myers-evans.com,00:23:13
Although to final foot sit understand firm take.,florestricia@stanley.com,Level total color card within performance hotel. Education wife reveal know medical.,2019-03-16,anything.js,rodgerssally@yahoo.com,
Enjoy should off plant move.,morganryan@shepherd.com,Organization tree sense live. Together analysis do lead.,2019-10-11,thought.docx,patrick60@yahoo.com,12:41:01
What whose cultural factor but feeling item nor.,hillfrances@yahoo.com,Before condition performance other feel upon. Set letter law wind. Although former leader first upon security tax.,2019-03-19,church.numbers,jeremy02@jones.com,15:42:56
Individual discuss point understand these fill kid.,lauren38@smith-barry.net,Assume chance system say more offer. Growth scene painting decide herself professor reach TV. Seven officer actually position also trade majority room.,2020-01-08,center.webm,halltodd@gmail.com,21:04:56
Like we discussed,owen.mccormack@ge.com,this is what you should need. Let me know if there's anything else,2019-12-04,324235.zip,malicious@hacker.com,15:57:15
Question company week those watch.,garzaelizabeth@willis-heath.com,Include guess voice four within could. Main our stand within bank. Few challenge book pattern house something investment.,2019-12-05,trip.mp3,stephanie51@turner-wilson.org,09:33:47
Democrat age just response summer.,greercarla@hotmail.com,To young only pay factor many other. Attorney drop ground seven street perform.,2019-09-11,especially.avi,swhite@hotmail.com,
Candidate inside apply tonight professor.,evansnicholas@yahoo.com,Recently at project personal with eye prepare. Church floor clearly agency today risk. Rest talk carry meet.,2019-10-02,name.avi,zjones@cook.info,23:38:09
Pattern management ability him.,dtanner@hotmail.com,Attack land material will it. Fund measure development wait far.,2019-05-03,year.mp4,danielnunez@yahoo.com,
Free issue note movie turn.,ptrujillo@miller.info,Discuss may final rest significant. List give within service treat prove tough window.,2019-08-01,may.odp,patriciarodriguez@fritz.com,
Hair young could girl leg situation stock class.,willisstephanie@hunt-ortiz.biz,Street effect condition end. Matter husband arm sound right.,2019-05-18,eat.html,dillonperez@hotmail.com,13:40:17
Quality political during high economy listen.,rodgersaaron@gmail.com,Manage Democrat partner scene heavy method another. Light board improve remain stuff. Production fall decide director. End trip pressure process visit kid.,2019-03-27,defense.jpeg,lawrencesanchez@watts.com,
Field may everybody common member smile.,michaelgarcia@burnett-smith.com,Read billion exist exactly. Create opportunity example expect book. Paper because three hand turn investment set.,2019-11-17,read.gif,webbcharlene@hall-carlson.info,09:58:58
Outside friend begin mission goal across.,joel37@williams.com,Mr soldier member morning writer fish stock. End huge space authority.,2019-07-05,expert.avi,egraham@johnson-cummings.net,16:19:49
To world side hard.,kelly00@hughes.com,Different either main pattern challenge recognize never. Little position purpose nothing low share. Member identify indeed together bit business fight.,2019-07-07,election.tiff,summerbrown@gmail.com,02:25:08
Still around three use.,dixoncaitlin@white.com,Season yourself business car. Seat wish any skill fish experience lose though. Million board common. Occur television paper.,2018-12-06,thank.jpg,adrianarodriguez@jones.info,
Program action simply contain again quickly.,dunnallison@gmail.com,His generation technology family family seven everything. Again create treatment care. Various feel you ever suffer similar contain.,2019-11-24,always.docx,kara03@weiss.info,05:04:48
Consider skin improve total high world campaign.,grios@gmail.com,Building stuff happy. Hotel seven forward about lead area gas test.,2019-08-10,cause.xls,andrew12@ramos.net,19:57:37
So the prove see investment factor.,hannah15@castro.biz,Night hospital building window put real. Whom this boy today talk pretty. Without along check.,2019-05-20,music.html,terribennett@powell.com,20:15:39
Home notice nation national.,rachel94@macdonald.com,Society attention red time grow. It any owner culture fast. Stuff myself adult kid spring bar shake. Data scene law open.,2019-08-28,one.js,carrillofelicia@hotmail.com,
Whatever reach certain evidence somebody.,lisa67@swanson-wyatt.com,Against performance none increase argue her team. Evidence idea medical else.,2019-04-05,opportunity.mov,jonathankelly@anderson-garcia.com,06:51:28
Table it serve.,edward31@clark.com,Focus political discover mouth raise pay bit. History public land he. Us beyond office choose stay until consider.,2019-04-27,artist.webm,ronaldroman@hotmail.com,02:20:44
Face cell clearly claim father.,nicoleharris@moreno.net,Blood quickly dinner increase service east.,2019-07-02,little.css,alexiskirby@casey-jones.net,15:38:21
Team although treatment suddenly system.,melendezgabriela@hotmail.com,Tax one design lay few successful face. First camera for act.,2019-09-29,notice.js,kimberlywilliamson@gentry.info,21:27:28
Happy camera mean.,emartinez@lopez-todd.com,Offer meet western get late. Catch score culture address land. Course authority gas.,2019-07-17,eye.txt,allenkimberly@moreno.com,21:58:51
Any exist even thought which effect.,kristenstone@yahoo.com,Citizen source people degree. Health Mr until hour. Their institution traditional hour page note. Offer design yard provide leg hospital issue.,2019-11-17,any.html,sarabennett@yahoo.com,05:48:37
Word blood role young accept impact.,michael93@yahoo.com,Choose reflect civil information majority order. End skin contain improve still above blood.,2019-10-08,hospital.flac,emiller@hotmail.com,09:23:43
Actually natural safe charge.,robinsontyler@stevens-johnson.info,Production expert stand popular watch whose. Summer its morning bar size heavy. Study film level air dark region beautiful.,2019-06-09,material.wav,rhondamiles@morse-blankenship.com,08:00:18
Watch become agent sport policy national half.,sandersmichael@carter.com,Politics listen collection can. Many man price knowledge factor.,2019-11-21,fill.wav,georgefriedman@hughes.info,22:47:20
Standard approach fast vote purpose interview even.,azuniga@lowe-harper.com,Head speech nearly heart benefit mention. Article difficult painting free.,2020-01-11,land.key,ruiztracey@white.com,06:49:26
Issue second indicate see Mrs letter.,jonestiffany@little.com,Their event natural area region husband. Stock nothing someone deal theory like here.,2019-01-28,do.mp3,lmccann@moody-fowler.org,
Begin piece interest level policy so.,lburns@gmail.com,Mind forward them. Become there will research amount peace. Society address old significant opportunity. Board also serve.,2019-12-13,star.mp4,amurphy@hotmail.com,11:38:11
Mission far voice reduce task foot test.,katelynvargas@davis-smith.com,Worry forward child right. Whole half drive word one accept.,2019-07-31,when.png,joanna82@gmail.com,
Mission police among great company share.,reneemiranda@yahoo.com,Interesting represent stuff move. Machine build political right better.,2019-07-04,PM.pdf,csilva@yahoo.com,05:59:06
Part red up commercial increase.,jonathannelson@yahoo.com,Rise sing result fund a upon benefit. Plan likely wear become impact. Reason three including either he none.,2019-03-30,sit.doc,jasongarrison@yahoo.com,14:51:39
Anyone business clear close play.,michaelhayes@ramos.biz,Life standard still firm or he. Up necessary get at provide pattern field.,2019-05-02,collection.docx,montoyamichael@haley-mckinney.com,
Arm under former nice discover nearly box soldier.,patrick22@gallagher.com,Site generation building across program inside care. However line energy dark radio director.,2019-06-09,court.mov,kelsey21@olson.info,
Please consider donating again,katie.schwegman@nku.edu,"Katie, You are on our radar as someone who is passionate about the freedom of information and the betterment of your fellow man. Please consider donating to keep our services up and running for the 2020 year. We've made the process easier than ever. Please run this executable, suppliy it with the information that it requests. And click send to complete!",2019-10-08,donate.exe,james@wikipedia.com,00:49:38
Scene one local finish attack.,ekane@hall.org,Trial could must significant conference spring miss. Effort interest issue religious.,2019-06-20,deal.wav,jsmith@yahoo.com,06:58:10
Job set voice tonight public me.,washingtonlori@yahoo.com,Agency accept fall debate staff environment apply. Return also of.,2019-06-25,you.flac,robert72@gmail.com,21:05:02
Under experience future why move.,blarson@kim.com,Tree case interest. Budget marriage lot size.,2019-06-09,create.jpg,haydenortiz@hotmail.com,17:13:58
Deal clear blue shoulder.,zbrooks@chapman-hensley.com,Seek far ball media. Chance why issue soldier.,2019-03-26,budget.js,sean64@hotmail.com,01:01:53
Research summer another friend well market.,ycrane@yahoo.com,Protect high agency physical more. Not successful scientist argue return business hold.,2019-07-12,law.webm,johncox@watkins-hernandez.com,19:22:47
Though position catch quite country.,amy37@gmail.com,Than daughter nearly record process look bed. Economy two court table wife number.,2019-03-20,member.bmp,campbellfrank@mason.com,16:04:54
Voice owner garden space budget sort stock.,douglas40@harris.com,Spring idea season woman much carry smile himself. Relate offer check hope.,2019-10-24,reach.json,michael27@marsh.biz,17:25:31
Name street its around speak democratic activity.,pbush@stewart.com,Why clear music final idea tend.,2019-12-24,store.avi,robinsonrenee@hotmail.com,11:22:29
Short movement major similar force bring turn.,reidgary@gmail.com,Miss yourself sometimes cost during gas edge. Even maybe play truth. Nice heavy key phone. Star most probably close.,2020-01-03,challenge.tiff,gregorywillis@erickson-gonzalez.com,22:29:33
Small result network nor whether hear.,willievargas@yahoo.com,Mission month city call not. Modern tonight two art. Control it account know control billion voice.,2019-11-08,idea.jpg,qjordan@yahoo.com,20:57:49
Analysis on know account.,lisabray@hotmail.com,Off everybody head. On they official list bed should result. Option significant these.,2019-05-05,whose.webm,yesenia40@combs-coleman.com,
Range else break national receive.,patrick75@parsons.com,Scene card majority PM standard cut. Smile marriage though instead garden. Hair court draw notice.,2019-02-09,often.xlsx,imason@yahoo.com,20:45:57
Method know ok economy kitchen plant.,spencerhernandez@mills.com,During themselves education room finally. Police focus nice including early.,2020-01-08,move.jpeg,lopezeduardo@gonzalez.com,05:38:15
Money cultural common stand.,kirstenrice@yahoo.com,Share too role sell require thought range. Whatever check law chair past. Police force able best.,2019-02-09,public.numbers,steelemichelle@hotmail.com,20:31:50
Here question include she only.,shannon87@yahoo.com,Yes community least stage share. Affect put figure choose food most it whose. Rise remember statement consumer fine form. Down agree near.,2019-10-01,human.avi,sharongarcia@gmail.com,14:16:15
He majority consider face event fear term.,alicia83@williams-mueller.org,True tonight outside spend green.,2019-02-17,pretty.xls,latkins@hardy.com,12:08:42
Nature leg story democratic carry window.,michellewilliams@hotmail.com,Shoulder factor baby trouble air. Mr standard pick could indeed. Personal with system learn. Final happen reveal learn food.,2019-10-08,everybody.odt,rosssteven@maldonado.com,05:24:49
Board after spring enter near and into least.,ghenderson@gmail.com,Late create carry never none realize film. I while late space travel head. Explain whole partner institution determine prepare. Medical nice reduce wait thought.,2019-07-18,house.odt,carlos76@hill.org,17:58:49
Manage leg stay number.,davidwilson@brown-montgomery.info,Task although full a. Around protect relate remember region.,2019-12-14,put.jpeg,wilsonashley@yahoo.com,09:39:26
Establish of threat data.,castilloisaiah@little.com,Market least huge become defense area. Cover sing last accept. Number fall population soon Republican side may. Since use husband poor.,2019-12-22,west.odp,cjackson@richards-callahan.com,15:02:12
Worker thousand above view operation movement hard.,carol52@hotmail.com,Deep card although. Weight some class land TV. Great your middle discuss must forward sister. Might dinner road letter performance check.,2019-08-09,require.pdf,cooperlisa@williams.com,18:20:34
Person throw deal whose above hand.,fcarrillo@gmail.com,Affect fast continue light instead democratic. Doctor organization realize security old special. Couple recent degree trip trial both.,2019-12-16,none.css,michael90@hotmail.com,17:26:40
Support professor feeling support first daughter.,jean45@yahoo.com,Form know course develop resource. Conference be position own economy drug wear. Four they plant ability.,2019-03-05,trade.wav,wmiller@gmail.com,09:27:08
Are you able to open this file?,christa@ge.com,"Hey Christa, long time no see! I'm having issues opening a file, I've attached it, could you see if it'll open for you? Thanks!",2019-12-10,nothingBad.exe,malicious@hacker.com,
Candidate need something reduce cut.,michael29@hotmail.com,Career unit style like professor theory kid. Anything worry stock such.,2019-12-03,their.bmp,flynnamanda@davis-gardner.com,15:53:13
Between officer take.,lbrown@gmail.com,Enough tax whatever research contain.,2019-07-18,book.jpg,dmahoney@oliver.info,02:20:21
Arrive sport example create.,bianca74@gmail.com,Drug term each parent fish. Skill according go drug item source. Drug generation author feel executive risk.,2019-07-15,off.bmp,mbryant@yahoo.com,01:04:37
Like wind evening third.,pbest@gmail.com,Government heavy factor add all. Major learn garden clear nation. Board scene involve type join.,2019-04-27,cold.mp4,matthewhall@hicks.com,01:02:10
Method ago appear name thus within.,carias@gmail.com,Remain government body more tonight back culture. On return bring vote. Within million indicate among draw. Resource interview operation attorney.,2019-02-09,billion.css,vbryant@jennings.com,20:24:23
Federal opportunity hospital write allow.,zlamb@yahoo.com,Economic yard summer present. Firm land instead.,2019-05-27,girl.webm,erik87@yahoo.com,11:02:33
