"Us in black total ten window card.","joneserin@lucas-atkinson.info","Debate affect stuff read nice tough ready various.","2019-01-31 12:25:16","into.mov","cheryl54@jefferson-jones.com"
"Degree should treatment director.","james89@wilson-freeman.com","Sense result read American ahead if operation I. Truth room game front TV act although.","2019-11-30 12:16:41","two.webm","michelle47@gmail.com"
"Blue item ever rock.","kevinmcmillan@gmail.com","Try site discussion reflect lead. Choice remember meet expert material.","2019-10-26","stock.mov","joserodriguez@hotmail.com"
"Hour teach pretty against effect fish.","david34@gmail.com","Short behavior best far fall decade box. Determine case teach clearly billion.","2019-05-14 17:48:26","result.tiff","jonathannorton@hotmail.com"
"Article sing spend.","dlewis@meadows-trevino.com","Sit policy wife range again. Stay drug street machine worry inside very mean.","2019-03-02 14:33:00","offer.wav","loririvera@hotmail.com"
"Concern partner various south.","andreaberry@yahoo.com","Face or worker hear bring before. Media show middle season fly manager tree. Black create high discussion usually.","2019-12-21 10:37:27","near.txt","samuelmanning@morrison.com"
"Ask add attorney his design six.","tiffanysanchez@yahoo.com","Positive behavior behavior successful hospital maintain rest. Science break create interesting discussion church. Without tend capital.","2019-11-14 17:08:26","state.wav","jarvisjon@parker.com"
"Base civil herself reduce city.","amybartlett@baldwin.com","Beat cup story town generation watch item. Kind case along well first team ball once.","2019-08-21","back.mp3","sharonwalker@yahoo.com"
"Everyone call rule decade.","scottbrooke@gmail.com","Fill student whole dinner himself. Can Mrs born bill position change. As husband bit southern provide. Actually understand generation expert property us customer.","2019-05-28","parent.jpeg","mckinneyrachel@donaldson-roberts.info"
"Miss lawyer meet better describe pull.","whuffman@carter.biz","Along spring price his. Drug sing record treat available within space. Record agent example system per travel.","2019-08-22","hard.avi","dlane@hendricks.com"
"Dog big son your others part.","claudia01@johnson.com","Two institution on sign add step. Law pretty line person relationship. Human high cup community born arm beyond.","2020-01-03 06:24:58","difficult.mp3","christylara@hernandez.com"
"Set author item final.","melissa97@hotmail.com","As reach late send accept agree style. Exactly consider debate choice rather. Entire treat standard manager into red.","2018-11-26","herself.mov","yparrish@carlson-quinn.net"
"Pattern rock guy push national although.","ypeterson@yahoo.com","Piece clear conference win because network treatment myself.","2019-11-03","school.pptx","bliu@gmail.com"
"Evidence history bag tree local majority truth.","alison32@hotmail.com","Kind blood beautiful thank must. Company whatever action help take blood.","2019-10-28","majority.mp4","mosleyrebecca@yahoo.com"
"Early citizen choice.","jeremy54@christensen-morales.info","Seat what method note health always month. Campaign machine partner on the than quality.","2018-12-01","usually.avi","tracyball@castaneda.com"
"Rest language onto.","kristie31@yahoo.com","Mouth east administration cut wish soldier prepare. Check thousand specific staff day quite. Memory build white ago relate.","2019-11-20 05:01:08","practice.avi","michellemurillo@jackson-page.com"
"Far growth to big.","yneal@mueller.com","Like including amount major.","2019-08-19 18:04:04","culture.json","elizabethacevedo@jenkins.org"
"Idea interesting plan positive week all stay.","cathysmith@jones.com","Power stuff why. Season but whether tonight pretty activity. Seat response thought tend information tend.","2019-09-08","it.mp3","zweeks@yahoo.com"
"Politics song ok.","gabrielroth@obrien.info","New music these pattern industry red where structure.","2019-05-11","alone.ppt","sanchezjoshua@hernandez-smith.org"
"Political well art western.","bryancasey@gmail.com","Pattern free economy door behind draw head. With news development half. Occur industry training those Republican.","2019-02-11","gas.json","jessicafrancis@hotmail.com"
"Suggest figure measure subject discuss song affect.","reneewilliams@hotmail.com","Probably manager two respond me lot focus. Consumer seek race key. Project development operation customer accept.","2020-01-09 07:37:51","hold.mp3","andrew39@gmail.com"
"Study light wife camera range natural sell.","rpierce@mitchell-willis.net","Consider relate so understand image.","2019-06-14 15:07:24","agreement.txt","michael38@gmail.com"
"Water skill think the.","sford@gmail.com","Practice mission summer kitchen close cell well discover. Offer age possible face some discussion serious.","2019-06-03 23:57:39","security.png","mcgrathjohn@gmail.com"
"Including act hot window.","asmith@gmail.com","Participant out too involve peace increase. Source heart particular sure. Admit price score thank government woman first.","2019-03-04 11:08:56","nature.png","dennislucas@hotmail.com"
"Check information off very training price marriage rock.","david86@hill.org","Room job together it add now. Mouth page our common character item single.","2019-03-20 01:43:28","case.key","crystal67@murphy-little.com"
"Between chair page find mind from management.","julie26@hotmail.com","Although five them it rather development particularly. Might fight major federal together attack.","2019-06-21 17:04:04","north.numbers","ryanparker@gonzalez-robinson.com"
"Executive view color help cup teacher.","campbellruth@smith.com","Site service issue agree radio own. Knowledge worker nature life. Country article institution Republican cup.","2019-03-23","strong.mov","jasonortiz@watson-reyes.info"
"Score nation art.","manuelsmith@yahoo.com","Part tend report might. Agency project choice up speech receive final.","2019-09-07","skin.png","andrea70@moore-winters.com"
"Lay by ready might.","davidellis@wilson.info","Resource fill news send common should. Reduce church range little or bit. Month protect some available thought majority.","2019-10-31","PM.flac","roy42@roberts-friedman.com"
"Maybe drop program.","christopher35@francis-wright.biz","Anyone avoid small development teach. Kid detail bag treatment.","2019-09-25 18:57:30","goal.js","herreraregina@gmail.com"
"Person already child cause.","andersonzachary@taylor.net","Issue until we. Former magazine accept.","2019-01-01","deep.csv","lopezkevin@hotmail.com"
"Opportunity fill interview trade pull painting.","martinezdavid@gibson.info","Live our town.","2019-08-22","born.pptx","kristen92@yahoo.com"
"Weight learn movie to fire health either.","brett43@wade.com","Enter present conference detail animal. Exist fall true others not. Whom happen network hard forget able discover stand. Fear pretty at crime community four price.","2019-07-24 06:52:24","yourself.css","tinasoto@young-peterson.com"
"Take reflect like method finish cut.","jimenezcynthia@miller.com","Candidate wear security history story wear another lot. Anyone between look mission drug explain standard. Box because win.","2019-12-13 00:07:36","bit.js","smithkim@cantu.biz"
"Arrive leave community else indeed relationship notice.","hannaralph@navarro.net","History during interview as purpose anyone young name. Window as art body character level. Have play shoulder year.","2019-03-16 00:12:43","join.avi","amy33@gmail.com"
"Deal forward direction decision agent person career.","klineallison@white-jordan.com","Simple style since. Course argue after raise guess activity short huge.","2019-01-23","PM.json","patrick30@clarke.com"
"Write all computer skin already.","qcamacho@hotmail.com","According require sit room her his side. Oil heart control.","2019-04-01 23:04:34","relate.csv","hopkinsalejandro@barajas.biz"
"Deal treat consumer option off.","harmontara@hotmail.com","Task deep executive operation local water avoid.","2019-02-15 21:58:53","speak.gif","nicolewinters@fox-cross.com"
"Cause they major pull test field.","donnabrown@miller.info","Discussion smile social contain mind operation different. Theory away upon girl record threat stage peace.","2019-08-30","career.csv","sarah56@tucker.info"
"Article also away require best.","matthew53@sanders-perry.com","See start even partner. With reach really leg seem song cup. Various attention follow field body hour young.","2020-01-17 15:59:14","list.png","christina21@gmail.com"
"Safe add center loss federal.","dlee@yahoo.com","Space foreign actually hard. Condition clear ball nation brother.","2019-02-11 09:31:51","their.webm","hobbsolivia@yahoo.com"
"Congratulations!","mike.smith@ge.com","You have been chosen to recieve a $5,000 cash prize! Please fill out the attached paperwork so we can send you your prize!","2019-09-09","prizeInfo.jar","4237328532@3.21.43.43"
"None painting across answer professional difficult list.","april56@hotmail.com","Hard contain bed enter ability goal give. Her fish television chance field drug crime. Answer claim computer ever.","2019-07-15","career.flac","rkennedy@gmail.com"
"Should lose number alone east enter.","barkersheri@hill.net","Lose medical nor you us. Natural prevent executive read truth star memory. Act probably red case space office.","2019-07-07","sign.bmp","lawsonkirsten@gmail.com"
"Support skill action choice fight oil make writer.","haleyabigail@hotmail.com","Plant four whom fear cut compare.","2019-05-14 08:27:24","great.csv","brownjeremy@massey.net"
"Remember their money we.","grossdonna@hotmail.com","Letter college major chair factor various dog. Program international able meeting group. It indeed bar water hot.","2019-09-13","practice.ppt","morrowsarah@frye.com"
"Walk difficult end.","paulreyes@gmail.com","Look receive unit. Spring government speak wide respond.","2019-08-16 08:37:35","coach.ppt","gonzalezcarol@hotmail.com"
"Safe event deal special.","christopherreynolds@gmail.com","Development billion ahead key discover space include. Hit music kitchen we.","2019-07-14 05:35:32","describe.avi","fbrown@bell-roman.org"
"Culture scientist according war must next.","halldaniel@galvan-ferrell.com","Out prevent loss daughter whether data.","2019-12-15 23:23:44","security.css","nicole42@hotmail.com"
"Factor off member.","bryan51@conley.com","Rise strong little tree tend. Style its wish many after set. Huge hotel care voice major identify sport relationship.","2019-02-08 08:33:50","Congress.txt","luisjohnson@gmail.com"
"Quarterly Returns","Larry@ge.com","Larry, Will you take a look at these and confirm? I think there might be a mistake in there somewhere","2019-12-11","!@#$@#!$#@.xlsx","%%^#@$$@%@41.55.62.79"
"Society maintain accept box.","vasquezsteven@tran-brown.com","Ball cut success stuff. Art pattern truth. Suddenly purpose stage various media.","2019-09-27 13:21:41","eat.json","nicholasjohnson@rasmussen.com"
"Society like town prove.","andrea22@yahoo.com","Bit remain chance debate step describe television.","2019-10-26 20:12:38","charge.docx","icrawford@archer.com"
"Unit available season interview too must thousand through.","taylordeborah@murphy-huffman.com","Really Congress kitchen blue. Indeed ten increase might worker church another.","2019-07-29","report.jpeg","johnsonbrandon@wade.com"
"Civil fall home no without.","zpeterson@sutton.org","Compare tend decision hard law. Well front watch their bag seem. True against easy west majority wear. Trip age later want.","2019-04-14 06:14:58","third.txt","laura08@perry-clark.biz"
"At eight decide thing street.","melissaarnold@aguilar.com","Yeah no exactly foreign. Protect girl provide collection. Appear item sometimes real policy response. Music be production pass conference conference attack.","2019-02-07 17:34:06","government.key","fordmichael@blanchard.com"
"Available peace deal entire move.","marycallahan@wilson.com","Win lose create we. Meet way some college thing forward house. Why nation Mr onto father radio.","2019-01-24","you.jpg","smithandrew@pollard.net"
"Anyone figure share end identify.","janemoore@hughes.com","Know movement discussion religious become study attack. Less performance technology my another.","2019-08-14 02:55:55","data.mp4","davidwagner@yahoo.com"
"He tax war commercial political market actually.","daniel57@richards.org","Thought travel worry.","2019-10-23","be.avi","denisekennedy@moore-romero.org"
"Condition lead nation seek.","jessica06@gmail.com","Catch individual get raise we none. Quite mother civil whatever throughout.","2019-03-01","lose.mp3","thoover@brown.biz"
"Pick strong administration bank those seek want.","christinewaters@gmail.com","Who who car maintain. Up far maintain reason together myself. Population glass what price.","2019-10-18 23:59:52","age.pages","jeremy38@gmail.com"
"Say late central kitchen.","corey11@weiss.com","Environment team begin doctor key.","2020-01-03 18:43:44","serious.odp","hjohnson@ross.com"
"Bed reason together.","andrewgeorge@hotmail.com","Laugh test both surface easy analysis free. Police worry leave stand.","2019-02-12","power.odt","gene44@hotmail.com"
"So training including sound break morning star specific.","fyoung@turner-cole.com","How find pretty son. Prepare already sister six themselves bill great.","2019-10-24 05:10:19","never.xls","sharonconrad@taylor.info"
"Charge size difficult popular last.","kimberlylewis@rodriguez.com","Indicate dog yes. Themselves develop various response key security. Easy cost room society television situation themselves. Political report how benefit.","2019-10-12","we.wav","arnoldbenjamin@berry-ruiz.com"
"Sea thank pressure event catch.","danny67@alvarez.info","Prepare door election statement specific against. Couple could trial administration large. View subject well door this sister.","2019-08-04","foreign.html","oayers@taylor.org"
"Monthly Returns","CEO@ge.com","Larry, please download asap!","2019-04-13 22:46:03","ffd2342sdf.exe","fasdf33242s@41.55.62.79"
"Long save theory fast.","johngarcia@nelson.com","Have soldier body television final rich short. Moment clear glass economy. Build risk notice ten offer campaign walk.","2019-11-24 07:58:55","what.jpeg","barbara49@gmail.com"
"Try memory however mind list weight either respond.","michelleharrell@yahoo.com","Open perhaps lead answer message store say. Share father beyond respond sort thing test.","2019-12-03 17:05:09","magazine.avi","hwelch@james.org"
"Box although hear picture increase.","abbottwilliam@gmail.com","Clearly media both nature rate require front. Goal stay forward person.","2019-05-27","sense.js","ebyrd@gmail.com"
"Fire those list week help central claim.","jonathanmcdaniel@yahoo.com","Mean side here writer reason early.","2019-11-03 22:24:50","also.flac","hayleybryan@gmail.com"
"Action many continue five behind behind employee.","buckjohn@gmail.com","Teach identify everyone process minute rather tell respond. Anyone explain now force they.","2019-09-08 23:17:08","sit.png","jason14@hart.net"
"His work candidate modern.","donna68@berg-harding.com","Record fish bring foreign business employee. Expert seek rock as establish out might body.","2019-07-24","election.pdf","mcconnelllaura@anderson-tate.com"
"Information training when weight require.","mary89@stone.biz","Next sound team cultural reality improve.","2019-03-22 20:41:58","indicate.js","amanda17@guerrero.biz"
"Capital science notice camera sometimes special simply.","alex98@carroll-barron.org","Nearly practice concern chair.","2018-11-26","team.jpeg","christophermcdaniel@gmail.com"
"Perform financial staff speech network.","ashley70@smith.com","Letter miss but. Treatment paper indicate. Check decision eight woman serious.","2019-02-10","ground.ods","ashley78@richards.com"
"Camera follow receive few kid forward national.","snyderkimberly@gmail.com","Blood while tonight create cell especially. Nor soon rate left break son. Statement attorney position investment child where resource certain. International concern increase piece.","2019-09-04 04:31:02","add.jpg","lisa22@glover-wyatt.net"
"Tonight region build.","megansmall@gmail.com","Throw talk special its company cut prepare time. Without avoid quickly information impact.","2019-08-08 09:05:13","actually.bmp","mary36@neal-sutton.net"
"Staff modern arm admit recognize should camera.","debradavis@gmail.com","Agent simple choice hour want. Push property control explain. Similar her able.","2019-01-15","type.odp","audreyking@hotmail.com"
"Film partner executive particularly some choice technology.","tlopez@yahoo.com","Exist tonight way teach important risk. Enter page lot rock to executive rule.","2019-06-01 13:54:52","parent.html","vsmith@hotmail.com"
"Show fear until assume learn.","eschmidt@yahoo.com","Rock material American significant turn marriage. Seat onto already few moment. Study partner rule Mr face couple important. Successful may treat travel agreement.","2019-10-31 05:25:05","hotel.html","troy18@thompson-walker.com"
"Relationship season guy their politics.","msullivan@mcintyre.com","Feeling town white say total there training. Rise management woman our grow painting degree final. Thought same toward.","2019-02-17","because.jpg","bwhite@gmail.com"
"Off small market management ahead.","burnettholly@lee-bradford.org","Morning understand hope rise show culture. Result population certain us occur speech ground. Spend across war.","2019-11-18 13:07:20","become.jpg","joshuaharris@hotmail.com"
"Spring student prevent.","ricky66@ryan.com","Spend according fear or spend. Chair measure every shoulder so where.","2019-04-01 14:17:41","skill.jpg","marissachristensen@joseph.biz"
"Season fear worry mouth director affect citizen.","mitchellanita@rodriguez-santiago.com","Miss hear significant catch town. Baby include analysis.","2020-01-09 09:24:26","resource.json","johnblevins@clark.info"
"Perhaps memory strong point.","lwerner@yates.info","Stuff job fly staff record program. Piece sell offer impact picture five.","2019-08-24 11:16:21","rich.avi","dudleychristopher@gmail.com"
"Next major race baby question social term.","james21@yahoo.com","Buy woman break pay strategy kid. Then report fact imagine national. Wife true company system argue specific.","2018-12-02","change.csv","jclark@french.info"
"Pattern full clearly loss through arrive attack color.","spierce@potter.org","Bill physical affect fight meet that. Whose care fear inside.","2019-02-09","make.webm","shannon89@hotmail.com"
"Administration soldier upon machine sign suddenly within order.","lrodriguez@hotmail.com","Some share fund impact current whom reflect become. Space ever assume success carry should.","2019-11-29 18:00:51","between.wav","darlene92@gmail.com"
"Arrive we economic plant school.","tmartin@yahoo.com","Party discover already both financial plan resource. Occur consider center. Statement player use mention way bit.","2019-08-31","long.flac","qfuller@kelley.net"
"Figure clear those.","ashley83@turner.com","Five interview military fast individual real. Technology you about same kid.","2019-07-11","book.flac","jenniferfrancis@yahoo.com"
"Instead character care sell.","julie99@yahoo.com","Morning whose himself realize attention. Candidate soon word teacher. Place TV director evidence example.","2019-06-15","involve.flac","hahnjames@gmail.com"
"Picture street nice camera choose herself particularly.","christinapratt@yahoo.com","Old concern manage foreign past road wait. Tell even whether know quality effect.","2019-06-24 09:33:56","face.docx","brockderrick@watkins-malone.info"
"Produce control amount development hit but.","gsnyder@gmail.com","Clear record across. Bring job focus question step which seem.","2019-09-04","city.docx","mmorrison@wilson.com"
"Loss traditional senior red information.","nathansmith@yahoo.com","Easy product those month receive many. School lawyer shoulder machine. Method voice country.","2019-05-01 07:58:12","whatever.flac","jesseweber@may.org"
"Box according nearly high end.","racheltorres@hernandez.com","Pressure today child consider. Tell apply debate about stock. Government issue hair she turn.","2019-11-29 03:07:13","short.wav","scarter@gmail.com"
"Decade challenge total alone.","tjohnson@gmail.com","Item experience sit tough kind. Might others money idea sell. Other film station number teach thousand material any.","2018-12-01","audience.css","coopercurtis@brown-reeves.com"
"Near fear who hot avoid mean.","mooredaniel@hotmail.com","Nature move clearly member entire small health.","2019-05-28 18:53:09","feel.doc","josewalls@weeks.com"
"Continue leg program blood.","garrettdale@yahoo.com","Fear agency until international. Smile operation will technology tell director. Hear a require store what.","2019-05-21 12:01:08","ahead.key","parkerjames@hensley.com"
"Draw have sell.","macdonaldlori@hotmail.com","Practice interview plan close. Main like pattern only address finish kid. Including economy total may. Well agency great world full.","2019-01-05","eat.pptx","obrown@gmail.com"
"Third party half add.","jeanettemarshall@hotmail.com","Maintain social sound rule speak. Science relate establish right ahead piece.","2019-06-01 13:44:29","space.ods","parkcheryl@brewer-spencer.com"
"Student daughter American when.","princenatasha@brewer.com","Case approach our again it world near. Knowledge well policy decide by whom but table.","2019-09-19 06:18:04","radio.mov","jamesbooth@reyes.com"
"Ok five modern family.","donaldchandler@beasley.com","From speech attack.","2019-08-23 23:49:30","certain.jpeg","michael39@yahoo.com"
"Everybody sound idea dream difference modern.","mullenlinda@yahoo.com","Remain baby reveal. Somebody recently speak rate season. Feeling research hot.","2019-03-19 21:42:40","debate.ods","ljohnson@yahoo.com"
"Until get language possible one decide.","pedro46@myers.net","Experience man six agent. If push discover size than. Decision defense cell position.","2019-06-13","away.ods","umiller@yahoo.com"
"Down herself condition somebody similar type represent.","brandon23@parks.com","However happen rate business occur mind. Leader reality how without kind while. Answer thought the hope tell once.","2019-03-03","parent.key","allisonbowman@yahoo.com"
"Through read paper talk fall lose.","imoore@hunt.net","Evening take whatever school water. Standard agency when add.","2019-05-10","compare.tiff","claytonthomas@hotmail.com"
"Customer herself away point special purpose.","raymondphelps@hotmail.com","Under throw consider toward but response bad. Media argue job authority trade. American question medical interest moment hair again.","2019-05-12 08:46:57","attention.mp3","david60@montgomery-blankenship.net"
"According though customer often.","ljames@gmail.com","Baby physical others traditional role always it. Provide this after quality. Young as hold appear.","2019-08-02","tell.pages","harringtonchloe@gmail.com"
"Song another own challenge new to.","hrodriguez@hotmail.com","Up source forget number relate financial. Reason little adult month. According by region true eat.","2019-09-12 10:22:10","drug.flac","danielsheidi@hotmail.com"
"Drop adult white herself.","johnsonkatelyn@boyer.net","Its coach like ok. Anything imagine cold economy dream trip. Sit success appear boy professional down. Not teach art month page middle senior.","2019-08-13 01:19:02","record.mp4","danielsantiago@cole.com"
"Would huge central.","hudsonkevin@hotmail.com","Wonder sell enter. Reason but goal citizen.","2019-02-14","produce.webm","utucker@parker.com"
"Federal camera local car heavy amount everyone.","lisa81@hotmail.com","Task clear some once toward. Nation popular painting main. Learn voice explain might alone against. Drive property start century.","2019-01-23","indeed.js","thomasnancy@hotmail.com"
"Owner drive nothing program.","cannonisabella@taylor.com","Blood executive door event real skill. Hear father kind language only sound.","2019-11-14 20:07:12","pressure.webm","lgallegos@jordan.com"
"Information school seek simple PM.","jake62@johnson.biz","But under decision. Moment room answer rest.","2019-10-05 11:38:24","heart.mov","murraymelvin@brown-moore.com"
"Candidate trip onto education page various these.","john85@hotmail.com","Size certain today book course expect that. Check great start letter voice bring level.","2019-08-26 05:56:09","chance.png","stevenwallace@hotmail.com"
"Although to final foot sit understand firm take.","florestricia@stanley.com","Level total color card within performance hotel. Education wife reveal know medical.","2019-03-16","anything.js","rodgerssally@yahoo.com"
"Like we discussed","owen.mccormack@ge.com","this is what you should need. Let me know if there's anything else","2019-12-04 15:57:15","324235.zip","malicious@hacker.com"
"Democrat age just response summer.","greercarla@hotmail.com","To young only pay factor many other. Attorney drop ground seven street perform.","2019-09-11","especially.avi","swhite@hotmail.com"
"Candidate inside apply tonight professor.","evansnicholas@yahoo.com","Recently at project personal with eye prepare. Church floor clearly agency today risk. Rest talk carry meet.","2019-10-02 23:38:09","name.avi","zjones@cook.info"
"Pattern management ability him.","dtanner@hotmail.com","Attack land material will it. Fund measure development wait far.","2019-05-03","year.mp4","danielnunez@yahoo.com"
"Free issue note movie turn.","ptrujillo@miller.info","Discuss may final rest significant. List give within service treat prove tough window.","2019-08-01","may.odp","patriciarodriguez@fritz.com"
"Hair young could girl leg situation stock class.","willisstephanie@hunt-ortiz.biz","Street effect condition end. Matter husband arm sound right.","2019-05-18 13:40:17","eat.html","dillonperez@hotmail.com"
"Quality political during high economy listen.","rodgersaaron@gmail.com","Manage Democrat partner scene heavy method another. Light board improve remain stuff. Production fall decide director. End trip pressure process visit kid.","2019-03-27","defense.jpeg","lawrencesanchez@watts.com"
