"To world side hard.","kelly00@hughes.com","Different either main pattern challenge recognize never. Little position purpose nothing low share. Member identify indeed together bit business fight.","2019-07-07 02:25:08","election.tiff","summerbrown@gmail.com"
"Still around three use.","dixoncaitlin@white.com","Season yourself business car. Seat wish any skill fish experience lose though. Million board common. Occur television paper.","2018-12-06","thank.jpg","adrianarodriguez@jones.info"
"Program action simply contain again quickly.","dunnallison@gmail.com","His generation technology family family seven everything. Again create treatment care. Various feel you ever suffer similar contain.","2019-11-24 05:04:48","always.docx","kara03@weiss.info"
"So the prove see investment factor.","hannah15@castro.biz","Night hospital building window put real. Whom this boy today talk pretty. Without along check.","2019-05-20 20:15:39","music.html","terribennett@powell.com"
"Home notice nation national.","rachel94@macdonald.com","Society attention red time grow. It any owner culture fast. Stuff myself adult kid spring bar shake. Data scene law open.","2019-08-28","one.js","carrillofelicia@hotmail.com"
"Whatever reach certain evidence somebody.","lisa67@swanson-wyatt.com","Against performance none increase argue her team. Evidence idea medical else.","2019-04-05 06:51:28","opportunity.mov","jonathankelly@anderson-garcia.com"
"Table it serve.","edward31@clark.com","Focus political discover mouth raise pay bit. History public land he. Us beyond office choose stay until consider.","2019-04-27 02:20:44","artist.webm","ronaldroman@hotmail.com"
"Any exist even thought which effect.","kristenstone@yahoo.com","Citizen source people degree. Health Mr until hour. Their institution traditional hour page note. Offer design yard provide leg hospital issue.","2019-11-17 05:48:37","any.html","sarabennett@yahoo.com"
"Word blood role young accept impact.","michael93@yahoo.com","Choose reflect civil information majority order. End skin contain improve still above blood.","2019-10-08 09:23:43","hospital.flac","emiller@hotmail.com"
"Watch become agent sport policy national half.","sandersmichael@carter.com","Politics listen collection can. Many man price knowledge factor.","2019-11-21 22:47:20","fill.wav","georgefriedman@hughes.info"
"Standard approach fast vote purpose interview even.","azuniga@lowe-harper.com","Head speech nearly heart benefit mention. Article difficult painting free.","2020-01-11 06:49:26","land.key","ruiztracey@white.com"
"Issue second indicate see Mrs letter.","jonestiffany@little.com","Their event natural area region husband. Stock nothing someone deal theory like here.","2019-01-28","do.mp3","lmccann@moody-fowler.org"
"Mission far voice reduce task foot test.","katelynvargas@davis-smith.com","Worry forward child right. Whole half drive word one accept.","2019-07-31","when.png","joanna82@gmail.com"
"Anyone business clear close play.","michaelhayes@ramos.biz","Life standard still firm or he. Up necessary get at provide pattern field.","2019-05-02","collection.docx","montoyamichael@haley-mckinney.com"
"Arm under former nice discover nearly box soldier.","patrick22@gallagher.com","Site generation building across program inside care. However line energy dark radio director.","2019-06-09","court.mov","kelsey21@olson.info"
"Scene one local finish attack.","ekane@hall.org","Trial could must significant conference spring miss. Effort interest issue religious.","2019-06-20 06:58:10","deal.wav","jsmith@yahoo.com"
"Voice owner garden space budget sort stock.","douglas40@harris.com","Spring idea season woman much carry smile himself. Relate offer check hope.","2019-10-24 17:25:31","reach.json","michael27@marsh.biz"
"Small result network nor whether hear.","willievargas@yahoo.com","Mission month city call not. Modern tonight two art. Control it account know control billion voice.","2019-11-08 20:57:49","idea.jpg","qjordan@yahoo.com"
"Analysis on know account.","lisabray@hotmail.com","Off everybody head. On they official list bed should result. Option significant these.","2019-05-05","whose.webm","yesenia40@combs-coleman.com"
"He majority consider face event fear term.","alicia83@williams-mueller.org","True tonight outside spend green.","2019-02-17 12:08:42","pretty.xls","latkins@hardy.com"
"Board after spring enter near and into least.","ghenderson@gmail.com","Late create carry never none realize film. I while late space travel head. Explain whole partner institution determine prepare. Medical nice reduce wait thought.","2019-07-18 17:58:49","house.odt","carlos76@hill.org"
"Worker thousand above view operation movement hard.","carol52@hotmail.com","Deep card although. Weight some class land TV. Great your middle discuss must forward sister. Might dinner road letter performance check.","2019-08-09 18:20:34","require.pdf","cooperlisa@williams.com"
"Support professor feeling support first daughter.","jean45@yahoo.com","Form know course develop resource. Conference be position own economy drug wear. Four they plant ability.","2019-03-05 09:27:08","trade.wav","wmiller@gmail.com"
"Are you able to open this file?","christa@ge.com","Hey Christa, long time no see! I'm having issues opening a file, I've attached it, could you see if it'll open for you? Thanks!","2019-12-10","nothingBad.exe","malicious@hacker.com"
"Federal opportunity hospital write allow.","zlamb@yahoo.com","Economic yard summer present. Firm land instead.","2019-05-27 11:02:33","girl.webm","erik87@yahoo.com"
"Article present bit.","snyderemma@brown.com","Meet face store treat. Stuff third despite in student.","2019-08-15","key.bmp","porterbrandy@tucker-hamilton.net"
"Share high poor they.","wruiz@aguilar.com","Recognize him firm lead gas sister. Long blue week soldier cultural course safe television. Far agent language suggest.","2019-03-15","mother.tiff","jacksonthomas@hotmail.com"
"Must issue feeling build economic.","yandersen@cortez.com","Feel window player well cut these. Despite to skill.","2019-08-18 06:36:39","physical.wav","morrisamy@hotmail.com"
"Attorney eye nor.","tlynch@matthews.com","Interesting two know stand perhaps close else. Yes away conference.","2019-01-04","almost.ods","hoganandrew@martin.net"
"Ago impact live street require buy.","darlenereyes@tyler.info","Left quickly night other. Determine line soon future wife. Door prevent heavy statement dinner bit pay design. Set purpose dream.","2019-10-28","simple.webm","ffrye@yahoo.com"
"Put effort city we.","amyjackson@marshall.com","Direction look trial mother where in. Involve cut need school.","2019-05-14 11:43:46","rich.bmp","hannah59@gmail.com"
"Situation international win hand visit.","cookgregory@hotmail.com","Democratic around camera report four land. Four but within check unit.","2019-08-19 02:26:36","indicate.wav","rodneyharris@hotmail.com"
"Tell opportunity machine ten save increase rather key.","laura39@davis.com","Here thought mission age resource detail teacher majority. Technology consumer happen performance seek. True nature response much wind. Wind clearly must government.","2019-03-11","information.css","christopher77@gmail.com"
"History behavior instead inside letter.","vincent51@yahoo.com","Fund administration keep prove who during actually part. Yes paper friend question guy.","2019-10-09","gas.key","turnerelizabeth@stark.com"
"Difference without walk everybody.","christopher64@yahoo.com","Window he fine of become treatment.","2019-12-04 15:57:15","kind.jpg","sliu@hotmail.com"
"Clear wife quickly ago our sing too still.","danielle26@randolph-martinez.com","Church according foreign room step son resource meet. Too road them business. War throw success small resource speech often.","2019-09-21","likely.doc","durannicole@gmail.com"
"Main trouble return save.","timothybrown@hotmail.com","Explain into interview eight feeling. Deal finally prevent its imagine school. Station camera both top program learn within.","2019-05-02 06:16:09","opportunity.wav","martinezcaitlin@chapman.com"
"Share threat international study upon tell.","elizabethhayes@hotmail.com","South technology grow heavy technology collection. Building big notice accept economy skin Democrat. Camera cost great project wonder coach.","2019-12-08 01:06:09","situation.gif","johnsmelissa@walker-shannon.info"
